{
  "version": "0.2.0",
  "sorts": [
    "entity",
    "episode",
    "action",
    "content",
    "option",
    "capacity",
    "quality",
    "norm",
    "principle",
    "world",
    "collection",
    "system",
    "process",
    "state",
    "quantity"
  ],
  "predicates": {
    "is_a": {
      "subject": "entity",
      "kind": "quality"
    },
    "has_quality": {
      "bearer": "entity",
      "quality": "quality"
    },
    "undergoes": {
      "subject": "entity",
      "episode": "episode"
    },
    "experiences": {
      "subject": "entity",
      "episode": "episode"
    },
    "aware_of": {
      "subject": "entity",
      "target": "any"
    },
    "has_content": {
      "episode": "episode",
      "content": "content"
    },
    "attends_to": {
      "subject": "entity",
      "target": "any"
    },
    "available_for_use": {
      "content": "content",
      "subject": "entity"
    },
    "represents": {
      "representation": "content",
      "target": "any"
    },
    "evaluates": {
      "subject": "entity",
      "option": "option"
    },
    "selects": {
      "subject": "entity",
      "option": "option"
    },
    "performs": {
      "subject": "entity",
      "action": "action"
    },
    "realizes_option": {
      "action": "action",
      "option": "option"
    },
    "causes": {
      "source": "any",
      "outcome": "any"
    },
    "agent_causes": {
      "agent": "entity",
      "action": "action"
    },
    "precedes": {
      "before": "any",
      "after": "any"
    },
    "cooccurs": {
      "left": "any",
      "right": "any"
    },
    "has_capacity": {
      "subject": "entity",
      "capacity": "capacity"
    },
    "offers_reason": {
      "content": "content",
      "option": "option"
    },
    "responds_to_reason": {
      "subject": "entity",
      "reason": "content"
    },
    "uses_tool": {
      "subject": "entity",
      "tool": "entity"
    },
    "learns_by": {
      "subject": "entity",
      "process": "process"
    },
    "envisages": {
      "subject": "entity",
      "option": "option"
    },
    "governs": {
      "norm": "norm",
      "action": "action"
    },
    "answerable_to": {
      "subject": "entity",
      "norm": "norm"
    },
    "morally_responsible": {
      "subject": "entity",
      "action": "action"
    },
    "attributes": {
      "observer": "entity",
      "target": "entity",
      "property": "quality"
    },
    "supports": {
      "support": "any",
      "dependent": "any"
    },
    "part_of": {
      "part": "entity",
      "whole": "entity"
    },
    "grounds": {
      "ground": "entity",
      "dependent": "entity"
    },
    "transfers": {
      "origin": "entity",
      "destination": "entity",
      "carrier": "entity"
    },
    "mediates": {
      "source": "entity",
      "mediator": "entity",
      "recipient": "entity"
    },
    "differentiates": {
      "source": "entity",
      "outputs": "list:entity"
    },
    "ranks": {
      "members": "list:entity"
    },
    "groups": {
      "whole": "collection",
      "members": "list:entity"
    },
    "qualifies": {
      "influence": "entity",
      "bearer": "entity",
      "quality": "quality"
    },
    "transitions": {
      "subject": "entity",
      "from": "state",
      "to": "state"
    },
    "orients_to": {
      "subject": "entity",
      "target": "entity"
    },
    "has_mode": {
      "subject": "entity",
      "mode": "quality"
    }
  },
  "sources": {
    "G-O": {
      "title": "P. D. Ouspensky, In Search of the Miraculous (reports of Gurdjieff)",
      "url": "https://www.globalgreyebooks.com/online-ebooks/p-d-ouspensky_in-search-of-the-miraculous_complete-text.html"
    },
    "B-R": {
      "title": "Alice A. Bailey, Esoteric Psychology I — The Seven Rays Enumerated",
      "url": "https://www.lucistrust.org/online_books/esoteric_psychology_volume_i/section_one_chapter_introductory_remarks/3_the_seven_rays_enumerated"
    },
    "B-Q": {
      "title": "Alice A. Bailey, Esoteric Psychology I — The Rays and Life-Quality-Appearance",
      "url": "https://www.lucistrust.org/online_books/esoteric_psychology_volume_i/section_two_chapter_the_seven_creative_builders_the_seven_rays/i_the_rays_and_lifequalityappearance"
    },
    "B-P": {
      "title": "Alice A. Bailey, Esoteric Psychology I — Question 4",
      "url": "https://www.lucistrust.org/online_books/esoteric_psychology_volume_i/section_one_chapter_ii_certain_questions_and_their_answers/question_4_what_value_is_it_know_about_the_seven_rays"
    },
    "P-E": {
      "title": "Plotinus, Enneads V.1, translation with Greek text",
      "url": "https://forage.com/plotinus/enneads/5-1-on-the-three-primary-hypostases/"
    },
    "P-S": {
      "title": "Stanford Encyclopedia of Philosophy, Plotinus (context and interpretation)",
      "url": "https://plato.stanford.edu/entries/plotinus/"
    },
    "P-V": {
      "title": "Plotinus, Enneads V.3 (self-knowing intellect and self-awareness), MacKenna translation",
      "url": "https://www.ccel.org/ccel/plotinus/enneads.v.iii.html"
    },
    "P-IV": {
      "title": "Plotinus, Enneads V.4 (contemplative experience)",
      "url": "https://www.ccel.org/ccel/plotinus/enneads.v.iv.html"
    },
    "D-T": {
      "title": "Dennett Tower of Generate-and-Test, summarized in peer-reviewed discussion",
      "url": "https://pmc.ncbi.nlm.nih.gov/articles/PMC8666905/"
    },
    "D-P": {
      "title": "Dennett, Conditions of Personhood (1976) as discussed in Cambridge journal article",
      "url": "https://www.cambridge.org/core/journals/social-philosophy-and-policy/article/abs/connected-selfownership-and-our-obligations-to-others/3396A63EB50E94D89BC97091EAF9106E"
    },
    "D-O": {
      "title": "Dennett, Conditions of Personhood (original essay scan)",
      "url": "https://philarchive.org/archive/DENCOP"
    },
    "B-S": {
      "title": "Alice Bailey, Esoteric Psychology I, question 1 (soul/personality distinctions)",
      "url": "https://www.lucistrust.org/online_books/esoteric_psychology_volume_i/section_one_chapter_ii_certain_questions_and_their_answers/question_1_what_is_the_soul_can_we_define_it_what_is_its_nature_part2"
    },
    "B-T": {
      "title": "Lucis Trust, The Science of the Seven Rays, discussion of Bailey",
      "url": "https://www.lucistrust.org/arcane_school/talks_and_articles/the_science_the_seven_rays"
    },
    "SEP-F": {
      "title": "Stanford Encyclopedia of Philosophy, Free Will",
      "url": "https://plato.stanford.edu/entries/freewill/"
    },
    "SEP-M": {
      "title": "Stanford Encyclopedia of Philosophy, Moral Responsibility",
      "url": "https://plato.stanford.edu/entries/moral-responsibility/"
    },
    "SEP-C": {
      "title": "Stanford Encyclopedia of Philosophy, Consciousness",
      "url": "https://plato.stanford.edu/entries/consciousness/"
    }
  },
  "claims": [
    {
      "id": "G01",
      "tradition": "gurdjieff",
      "statement": "The Ray of Creation orders worlds from the Absolute to the Moon, with increasingly numerous governing laws.",
      "scope": "gurdjieff",
      "symbols": {
        "Absolute": "entity",
        "all_worlds": "entity",
        "Milky_Way": "entity",
        "Sun": "entity",
        "planetary_world": "entity",
        "Earth": "entity",
        "Moon": "entity"
      },
      "expression": {
        "op": "atom",
        "predicate": "ranks",
        "roles": {
          "members": [
            "Absolute",
            "all_worlds",
            "Milky_Way",
            "Sun",
            "planetary_world",
            "Earth",
            "Moon"
          ]
        },
        "parameters": {
          "axis": "orders_of_laws",
          "values": [
            1,
            3,
            6,
            12,
            24,
            48,
            96
          ],
          "order": "ascending_constraint"
        }
      },
      "evidence": {
        "kind": "migrated_v0_1",
        "sources": [
          "G-O"
        ],
        "locator": "chapter 5 (Ray of Creation)"
      },
      "visual_guard": "Do not equate higher position with larger physical size.; The integers refer to claimed orders of laws, not empirically observed counts."
    },
    {
      "id": "G02",
      "tradition": "gurdjieff",
      "statement": "Terrestrial organic life mediates planetary influences to the Earth.",
      "scope": "gurdjieff",
      "symbols": {
        "planetary_world": "entity",
        "organic_life": "entity",
        "Earth": "entity"
      },
      "expression": {
        "op": "atom",
        "predicate": "mediates",
        "roles": {
          "source": "planetary_world",
          "mediator": "organic_life",
          "recipient": "Earth"
        },
        "parameters": {
          "kind": "influence",
          "time": "ongoing"
        }
      },
      "evidence": {
        "kind": "migrated_v0_1",
        "sources": [
          "G-O"
        ],
        "locator": "chapter 7 (organic life as transmitting station)"
      },
      "visual_guard": "Do not assume particles or physical stuff is transported."
    },
    {
      "id": "G03",
      "tradition": "gurdjieff",
      "statement": "Organic life emits differentiated radiations toward Sun, planets, and Moon; their requirements differ.",
      "scope": "gurdjieff",
      "symbols": {
        "radiation_from_organic_life": "entity",
        "solar_directed_radiation": "entity",
        "planetary_directed_radiation": "entity",
        "lunar_directed_radiation": "entity",
        "organic_life": "entity",
        "Sun": "entity",
        "planetary_world": "entity",
        "Moon": "entity"
      },
      "expression": {
        "op": "and",
        "items": [
          {
            "op": "atom",
            "predicate": "differentiates",
            "roles": {
              "source": "radiation_from_organic_life",
              "outputs": [
                "solar_directed_radiation",